{"schema_version":"1.0.0","id":"NOR-0001","entidade":"ENTIDADE FICTÍCIA","numero":"NORMA 0000","titulo":"Norma fictícia","edicao":"2026","data":"2026","vigencia":null,"escopo":[],"sistemas":["REVESTIMENTOS"],"assuntos":["Tema fictício"],"terminologia":[],"requisitos":[{"descricao":"Requisito inteiramente fictício para teste.","pagina":1,"secao_item":"1","status_verificacao":"VERIFICADO"}],"criterios_aceitacao":[],"metodos_verificacao":[],"ensaios":[],"limitacoes":[],"referencias_cruzadas":[],"aplicabilidade_temporal":"APLICABILIDADE_INCONCLUSIVA","proveniencia":{"arquivo":"norma-ficticia.pdf","sha256":"0000000000000000000000000000000000000000000000000000000000000000","norma":"NORMA 0000","edicao":"2026","pagina":1,"secao_item":"1","metodo_extracao":"PYPDF_TEXTO_DIGITAL","confianca":{"nivel":"ALTA"},"status_verificacao":"VERIFICADO"},"status":"VERIFICADO"}
